{
  "version": 1,
  "preset": "ai-pr-strict",
  "scope": { "allowed": ["src/**", "packages/**", "tests/**", "package.json", "pnpm-lock.yaml", "tsconfig.json"], "denied": [".github/**", "config/trusted/**", "config/policies/**", "config/evidence-contracts/**", "**/*.pem", "**/*.key"] },
  "verification": { "timeoutMinutes": 60, "maximumOutputBytes": 1048576, "commands": [{ "name": "frozen-install", "run": "pnpm install --frozen-lockfile", "timeoutMinutes": 10 }, { "name": "lint", "run": "pnpm lint", "timeoutMinutes": 10 }, { "name": "typecheck", "run": "pnpm typecheck", "timeoutMinutes": 10 }, { "name": "test", "run": "pnpm test", "timeoutMinutes": 20 }, { "name": "build", "run": "pnpm build", "timeoutMinutes": 10 }] },
  "reviews": { "minimumApprovals": 2, "requireExactHeadApproval": true, "blockChangesRequested": true },
  "reportedChecks": { "requireSuccess": true, "minimumCount": 1 },
  "output": { "uploadEvidenceBundle": true, "includeCommandPreview": true, "strict": true },
  "telemetry": { "enabled": true }
}
