{
  "version": 1,
  "preset": "typescript-basic",
  "scope": { "allowed": ["src/**/*.ts", "src/**/*.tsx", "tests/**/*.ts", "tests/**/*.tsx", "package.json", "pnpm-lock.yaml", "tsconfig.json"], "denied": [".github/**", "**/*.pem", "**/*.key"] },
  "verification": { "timeoutMinutes": 30, "maximumOutputBytes": 1048576, "commands": [{ "name": "frozen-install", "run": "pnpm install --frozen-lockfile", "timeoutMinutes": 10 }, { "name": "typecheck", "run": "pnpm typecheck", "timeoutMinutes": 10 }, { "name": "test", "run": "pnpm test", "timeoutMinutes": 10 }] },
  "reviews": { "minimumApprovals": 1, "requireExactHeadApproval": true, "blockChangesRequested": true },
  "reportedChecks": { "requireSuccess": true, "minimumCount": 1 },
  "output": { "uploadEvidenceBundle": true, "includeCommandPreview": true, "strict": true },
  "telemetry": { "enabled": true }
}
